{
  "schema": 1,
  "id": "example",
  "name": "Venue exemple",
  "licence": "CC-BY-4.0",
  "lang": [
    "fr",
    "en"
  ],
  "origin": {
    "lat": 45.5577,
    "lon": -73.7157
  },
  "plan": {
    "src": "plan.webp",
    "width": 4096,
    "height": 2731,
    "controlPoints": [
      {
        "px": 120,
        "py": 90,
        "lat": 45.5579,
        "lon": -73.7162
      },
      {
        "px": 3980,
        "py": 110,
        "lat": 45.55788,
        "lon": -73.7148
      },
      {
        "px": 3970,
        "py": 2640,
        "lat": 45.5572,
        "lon": -73.71482
      }
    ]
  },
  "defaults": {
    "captureRadius": 4,
    "revealRadius": 25,
    "arRange": 60,
    "strideLength": 0.7,
    "planMode": "north-up"
  },
  "debug": {
    "startPose": {
      "lat": 45.560089448816306,
      "lon": -73.71876267046022,
      "heading": 90
    }
  },
  "ancres": [
    {
      "id": "a-agora",
      "lat": 45.560089448816306,
      "lon": -73.71876267046022,
      "label": "Agora"
    }
  ],
  "reperes": [
    {
      "id": "r-studios",
      "type": "repere",
      "lat": 45.55923926291231,
      "lon": -73.71763634643162,
      "name": {
        "fr": "Studios Multimédia",
        "en": "Multimedia Studios"
      },
      "hint": {
        "fr": "Là où la lumière tombe du toit."
      },
      "tableaux": [
        {
          "kind": "boucle",
          "src": "media/atrium-loop.webm",
          "trigger": "regard",
          "loop": true
        },
        {
          "kind": "texte",
          "text": {
            "fr": "Sous la verrière."
          },
          "trigger": "approche"
        }
      ],
      "hidden": false,
      "captureRadius": 6
    },
    {
      "id": "r-agora",
      "type": "repere",
      "lat": 45.560089448816306,
      "lon": -73.71876267046022,
      "name": {
        "fr": "L'Agora",
        "en": "The Agora"
      },
      "hidden": false,
      "captureRadius": 6
    }
  ],
  "parcours": [
    {
      "id": "p-decouverte",
      "name": {
        "fr": "Découverte"
      },
      "ordered": false,
      "reperes": [
        "r-atrium"
      ]
    }
  ],
  "media": {
    "media/atrium-loop.webm": "sha256:4e562144af1a32d40676e96fe7bb8331fc55810b85bee92d4b890414b3cb2fe4",
    "media/atrium.opus": "sha256:4d9429d625741632564572076d90b7bfcb00be2b09d14a01eda473ff7f30021a"
  }
}
